<?xml version="1.0" encoding="UTF-8"?>
<job:job ID="0" dateOfCreation="2001-01-01" pressAgencyRef="http://tempuri.org" ref="http://tempuri.org" xmlns:job="http://www.example.org/photoBay" xmlns:xsi="http://www.w3.org/2001/XMLSchema-instance" xsi:schemaLocation="http://www.example.org/photoBay ../xml_schema_files/job.xsd ">
  <job:jobName>job:jobName</job:jobName>
  <job:urgency>job:urgency</job:urgency>
  <job:deadline>2001-01-01</job:deadline>
  <job:description>job:description</job:description>
  <job:payment>1</job:payment>
  <job:topics>
    <job:topicName>Sport</job:topicName>
  </job:topics>
  <job:status>new</job:status>
</job:job>
